{
  "asset_count": 3,
  "created_at": "2026-03-24T14:15:30Z",
  "data_path": "runs/run-contract.json",
  "downloads": {
    "csv": "../runs/run-contract/results.csv",
    "json": "../runs/run-contract/results.json",
    "xlsx": "../runs/run-contract/results.xlsx"
  },
  "enumeration_count": 1,
  "id": "run-contract",
  "judge_summary": {
    "accepted_count": 1,
    "discarded_count": 1,
    "evaluation_count": 1,
    "groups": [
      {
        "accepted": [
          {
            "confidence": 0.91,
            "explicit": true,
            "reason": "Brand match",
            "root": "example-store.com",
            "support": [
              "https://example-store.com/"
            ]
          }
        ],
        "collector": "web_hint_collector",
        "discarded": [
          {
            "confidence": 0.99,
            "explicit": true,
            "reason": "Third-party platform",
            "root": "facebook.com",
            "support": [
              "https://facebook.com/example"
            ]
          }
        ],
        "scenario": "ownership_hints",
        "seed_domains": [
          "example.com"
        ],
        "seed_id": "seed-1",
        "seed_label": "Example Corp"
      }
    ]
  },
  "label": "2026-03-24 14:15:30 +0000",
  "rows": [
    {
      "asset_id": "asset-root",
      "asset_type": "domain",
      "details": "Ownership owned | Reason Supported by discovery observations. | Resolution not_checked | Registrar Example Registrar | RegistrantOrg Example Corp | RegistrationStatus ok",
      "discovered_by": "rdap_collector",
      "discovery_date": "2026-03-24T14:15:00Z",
      "domain_kind": "registrable",
      "enumeration_id": "enum-1",
      "evidence_groups": [
        {
          "items": [
            "Registrar: Example Registrar",
            "Registrant organization: Example Corp",
            "Status: ok"
          ],
          "title": "Registration"
        }
      ],
      "identifier": "example.com",
      "inclusion_reason": "Supported by discovery observations.",
      "ownership_state": "owned",
      "registrable_domain": "example.com",
      "resolution_status": "not_checked",
      "seed_id": "seed-1",
      "source": "rdap_collector",
      "status": "completed",
      "trace_path": "#trace/run-contract/asset-root"
    },
    {
      "asset_id": "asset-sub",
      "asset_type": "domain",
      "details": "Ownership owned | Reason Supported by 2 discovery observations from crt.sh, hackertarget_collector | Resolution resolved | DNS A:203.0.113.10",
      "discovered_by": "crt.sh, hackertarget_collector",
      "discovery_date": "2026-03-24T14:15:05Z",
      "domain_kind": "subdomain",
      "enriched_by": "domain_enricher",
      "enumeration_id": "enum-1",
      "evidence_groups": [
        {
          "items": [
            "A:203.0.113.10"
          ],
          "title": "DNS"
        }
      ],
      "identifier": "api.example.com",
      "inclusion_reason": "Supported by 2 discovery observations from crt.sh, hackertarget_collector",
      "ownership_state": "owned",
      "registrable_domain": "example.com",
      "resolution_status": "resolved",
      "seed_id": "seed-1",
      "source": "crt.sh, hackertarget_collector",
      "status": "completed",
      "trace_path": "#trace/run-contract/asset-sub"
    },
    {
      "asn": 64500,
      "asset_id": "asset-ip",
      "asset_type": "ip",
      "details": "Ownership associated_infrastructure | Reason Connected to an owned domain by DNS. | ASN 64500 | Org Example Hosting | PTR edge.example.net",
      "discovered_by": "domain_enricher",
      "discovery_date": "2026-03-24T14:15:10Z",
      "enriched_by": "ip_enricher",
      "enumeration_id": "enum-1",
      "evidence_groups": [
        {
          "items": [
            "ASN: 64500",
            "Organization: Example Hosting",
            "PTR: edge.example.net"
          ],
          "title": "Network"
        }
      ],
      "identifier": "203.0.113.10",
      "inclusion_reason": "Connected to an owned domain by DNS.",
      "organization": "Example Hosting",
      "ownership_state": "associated_infrastructure",
      "ptr": "edge.example.net",
      "seed_id": "seed-1",
      "source": "domain_enricher",
      "status": "completed",
      "trace_path": "#trace/run-contract/asset-ip"
    }
  ],
  "seed_count": 1,
  "traces": [
    {
      "asset_id": "asset-root",
      "asset_type": "domain",
      "contributors": [
        {
          "asset_id": "asset-root",
          "discovery_date": "2026-03-24T14:15:00Z",
          "enumeration_id": "enum-1",
          "seed_id": "seed-1",
          "seed_label": "Example Corp",
          "source": "rdap_collector"
        }
      ],
      "discovered_by": "rdap_collector",
      "domain_kind": "registrable",
      "enumeration_id": "enum-1",
      "identifier": "example.com",
      "nodes": [
        {
          "badges": [
            "owned",
            "rdap_collector"
          ],
          "details": [
            {
              "items": [
                "Asset ID: asset-root",
                "Asset type: domain",
                "Contributors: rdap_collector",
                "Discovered by: rdap_collector",
                "Discovered at: 2026-03-24 14:15:00",
                "Domain kind: registrable",
                "Registrable domain: example.com",
                "DNS resolution: not checked"
              ],
              "title": "Result"
            },
            {
              "items": [
                "asset asset-root | source rdap_collector | enumeration enum-1 | seed seed-1 (Example Corp) | discovered 2026-03-24 14:15:00"
              ],
              "title": "Contributor Provenance"
            },
            {
              "items": [
                "Seed ID: seed-1",
                "Company: Example Corp",
                "Seed domains: example.com",
                "Seed tags: production",
                "Evidence: manual | company_name | Example Corp"
              ],
              "title": "Seed Context"
            },
            {
              "items": [
                "Enumeration ID: enum-1",
                "Status: completed",
                "Created at: 2026-03-24 14:13:00",
                "Started at: 2026-03-24 14:13:00",
                "Ended at: 2026-03-24 14:15:00"
              ],
              "title": "Enumeration"
            },
            {
              "items": [
                "DNS resolution: not checked",
                "Registrar: Example Registrar",
                "Registrant org: Example Corp",
                "Registration status: ok"
              ],
              "title": "Domain Evidence"
            },
            {
              "items": [
                "Ownership state: owned",
                "Inclusion reason: Supported by discovery observations."
              ],
              "title": "Ownership"
            }
          ],
          "id": "asset:asset-root",
          "kind": "asset",
          "label": "example.com",
          "linked_asset_id": "asset-root",
          "subtitle": "domain"
        },
        {
          "details": [
            {
              "items": [
                "Total observations: 1",
                "Discovery observations: 1",
                "Enrichment observations: 0",
                "Sources: rdap_collector",
                "Enumerations: enum-1",
                "First seen: 2026-03-24 14:15:00",
                "Last seen: 2026-03-24 14:15:00"
              ],
              "title": "Observation Summary"
            }
          ],
          "id": "asset:asset-root:observations",
          "kind": "group",
          "label": "Observations",
          "linked_asset_id": "asset-root",
          "parent_id": "asset:asset-root",
          "subtitle": "1 supporting observations"
        },
        {
          "badges": [
            "discovery",
            "2026-03-24 14:15:00",
            "owned"
          ],
          "details": [
            {
              "items": [
                "Observation ID: asset-root",
                "Kind: discovery",
                "Type: domain",
                "Identifier: example.com",
                "Source: rdap_collector",
                "Discovered at: 2026-03-24 14:15:00",
                "Ownership state: owned",
                "Inclusion reason: Supported by discovery observations."
              ],
              "title": "Observation"
            },
            {
              "items": [
                "Enumeration ID: enum-1",
                "Status: completed",
                "Created at: 2026-03-24 14:13:00",
                "Started at: 2026-03-24 14:13:00",
                "Ended at: 2026-03-24 14:15:00",
                "Seed ID: seed-1"
              ],
              "title": "Enumeration"
            },
            {
              "items": [
                "Seed ID: seed-1",
                "Company: Example Corp",
                "Seed domains: example.com",
                "Seed tags: production",
                "Evidence: manual | company_name | Example Corp"
              ],
              "title": "Seed Context"
            },
            {
              "items": [
                "DNS resolution: not checked",
                "Registrar: Example Registrar",
                "Registrant org: Example Corp",
                "Registration status: ok"
              ],
              "title": "Domain Evidence"
            }
          ],
          "id": "obs:asset-root",
          "kind": "observation",
          "label": "rdap_collector",
          "linked_asset_id": "asset-root",
          "linked_observation_id": "asset-root",
          "parent_id": "asset:asset-root:observations",
          "subtitle": "example.com"
        },
        {
          "details": [
            {
              "items": [
                "Unique seeds: 1",
                "Contributors: 1",
                "Enumerations represented: 1",